{
  "schema_version": "automate.control_plane_pin.v1",
  "enabled": true,
  "engine_sha": "2bd0e34ca903afef366feaa4847f06764a01006a",
  "auto_promote": true,
  "notes": "Activated 2026-10-08 after exact-head Automate Engine CI #251 and Security Audit #1152 passed on the pinned engine. Scheduled control cycle may reconcile, dispatch bounded workers, promote verified implementation PRs, and create canonical bookkeeping proposals. Scientific capability certification still requires the existing verification ladder."
}
